{
  "sets": {
    "missiles": [
      "M01",
      "M02",
      "M03",
      "M04"
    ],
    "targets": [
      "T01",
      "T02",
      "T03",
      "T04"
    ],
    "areas": [
      "A01",
      "A02"
    ]
  },
  "target_area": {
    "T01": "A01",
    "T02": "A02",
    "T03": "A01",
    "T04": "A02"
  },
  "target_value": {
    "T01": 771,
    "T02": 913,
    "T03": 701,
    "T04": 707
  },
  "missile_cost": {
    "M01": 569,
    "M02": 986,
    "M03": 248,
    "M04": 808
  },
  "missile_intrinsic_reliability": {
    "M01": 0.99,
    "M02": 0.99,
    "M03": 0.99,
    "M04": 0.99
  },
  "missile_em_reliability": {
    "M01": 0.985,
    "M02": 0.9867,
    "M03": 0.985,
    "M04": 0.985
  },
  "missile_target_damage_probability": {
    "M01": {
      "T01": 0.995,
      "T02": 0.8912,
      "T03": 0.9539,
      "T04": 0.9182
    },
    "M02": {
      "T01": 0.995,
      "T02": 0.8925,
      "T03": 0.9731,
      "T04": 0.9391
    },
    "M03": {
      "T01": 0.9603,
      "T02": 0.995,
      "T03": 0.8886,
      "T04": 0.986
    },
    "M04": {
      "T01": 0.9162,
      "T02": 0.995,
      "T03": 0.9204,
      "T04": 0.9814
    }
  },
  "single_interceptor_success_probability": {
    "M01": 0.005,
    "M02": 0.005,
    "M03": 0.005,
    "M04": 0.005
  },
  "area_interceptor_count": {
    "A01": 1,
    "A02": 1
  },
  "missile_health": {
    "M01": 1,
    "M02": 1,
    "M03": 1,
    "M04": 1
  },
  "missile_target_distance": {
    "M01": {
      "T01": 113.543,
      "T02": 118.116,
      "T03": 63.351,
      "T04": 87.742
    },
    "M02": {
      "T01": 130.421,
      "T02": 89.663,
      "T03": 66.468,
      "T04": 56.545
    },
    "M03": {
      "T01": 99.556,
      "T02": 168.944,
      "T03": 94.173,
      "T04": 248.944
    },
    "M04": {
      "T01": 179.076,
      "T02": 139.012,
      "T03": 251.443,
      "T04": 134.834
    }
  },
  "missile_range": {
    "M01": 163.543,
    "M02": 180.421,
    "M03": 218.944,
    "M04": 221.443
  },
  "area_reliability_threshold": {
    "A01": 0.9,
    "A02": 0.9
  }
}
